{
  "kind": "secret_scan",
  "schema_version": "secret-scan:v1",
  "id": "ST-STALE-A-secret-scan-20261010043418133-5c7354",
  "story_id": "ST-STALE-A",
  "delivery_id": null,
  "phase": "implementation",
  "summary": "Scanned 41 changed file(s) of ST-STALE-A for credentials",
  "base_sha": "0c7e6e0ea94ce25d8c1fe0d78e4274954adefd90",
  "head_sha": "0c7e6e0ea94ce25d8c1fe0d78e4274954adefd90",
  "workspace_state_hash": "80a5b48ad1984047a7b31f081e71aad43e966e91ba26a55c91fcc638a5df8ffe",
  "source": "git_range",
  "file_count": 41,
  "scanned_paths": [
    ".sdlc/authorization-uses/AUTH-STALE-A-STORY-ACTIONS/AUSE-AUTH-STALE-A-STORY-ACTIONS-20261010043406122-99e8a2.json",
    ".sdlc/authorization-uses/AUTH-STALE-A-STORY-ACTIONS/AUSE-AUTH-STALE-A-STORY-ACTIONS-20261010043407120-833970.json",
    ".sdlc/authorization-uses/AUTH-STALE-A-STORY-ACTIONS/AUSE-AUTH-STALE-A-STORY-ACTIONS-20261010043408026-8dd966.json",
    ".sdlc/authorization-uses/AUTH-STALE-A-STORY-ACTIONS/AUSE-AUTH-STALE-A-STORY-ACTIONS-20261010043414044-784594.json",
    ".sdlc/authorizations/AUTH-STALE-A-STORY-ACTIONS.json",
    ".sdlc/autonomy/approvals/AUT-APR-20261010043353102-32b96c.json",
    ".sdlc/autonomy/approvals/AUT-APR-20261010043402260-318abf.json",
    ".sdlc/autonomy/decisions/AUT-DEC-20261010043402280-cfa242.json",
    ".sdlc/autonomy/decisions/AUT-DEC-20261010043403839-d65ada.json",
    ".sdlc/autonomy/deliveries/AUT-STALE-A.json",
    ".sdlc/autonomy/executions/AUT-STALE-A/context-preflight.json",
    ".sdlc/autonomy/executions/AUT-STALE-A/start.json",
    ".sdlc/autonomy/requirements/AUT-REQ-STALE-A-R1.json",
    ".sdlc/contracts/CONTRACT-STALE-A.json",
    ".sdlc/output-contracts/registry.json",
    ".sdlc/output-contracts/templates/implementation-summary-v1.md",
    ".sdlc/receipts/verification/VERIFY-OUT-ST-STALE-A-implementation-summary-4578169c-971ef103.json",
    ".sdlc/requirements/REQ-STALE-A.json",
    ".sdlc/stories/ST-STALE-A/claim.json",
    ".sdlc/stories/ST-STALE-A/implementation-log.md",
    ".sdlc/stories/ST-STALE-A/plan.md",
    ".sdlc/stories/ST-STALE-A/steps/analysis.json",
    ".sdlc/stories/ST-STALE-A/steps/design.json",
    ".sdlc/stories/ST-STALE-A/steps/discovery.json",
    ".sdlc/stories/ST-STALE-A/steps/history.jsonl",
    ".sdlc/stories/ST-STALE-A/steps/implementation.json",
    ".sdlc/stories/ST-STALE-A/steps/validation.json",
    ".sdlc/stories/ST-STALE-A/story.json",
    ".sdlc/stories/ST-STALE-A/task-start.json",
    ".sdlc/tests/ST-STALE-A-test.json",
    ".sdlc/traces/.integrity/project.jsonl.checkpoint.json",
    ".sdlc/traces/.integrity/ST-STALE-A.jsonl.checkpoint.json",
    ".sdlc/traces/evidence/TR-20261010043416-2c5bc2/01-ST-STALE-A-test.json",
    ".sdlc/traces/project.jsonl",
    ".sdlc/traces/ST-STALE-A.jsonl",
    ".sdlc/workflows/instances/delivery-stale-a/checkpoint.json",
    ".sdlc/workflows/instances/delivery-stale-a/events.jsonl",
    ".sdlc/workflows/instances/delivery-stale-a/instance.json",
    "docs/implementation-summary-stale-a.md",
    "docs/shared.md",
    "src/feature.mjs"
  ],
  "excluded_paths": [],
  "rule_set_hash": "0fb6df2e725c5f9b66cc7380d8e96ccccb4f7abb224dbdcf3c50768368fd81de",
  "rule_ids": [
    "aws_access_key_id",
    "aws_secret_access_key",
    "github_token",
    "slack_token",
    "private_key_block",
    "assigned_credential_literal"
  ],
  "findings": [],
  "outcome": "clean",
  "started_at": "2026-10-10T04:34:17.859Z",
  "finished_at": "2026-10-10T04:34:18.256Z",
  "duration_ms": 397,
  "requirement_ids": [],
  "actor": {
    "id": "codex",
    "type": "agent",
    "name": "Codex",
    "email": null,
    "source": "default"
  },
  "git": {
    "is_git_repo": true,
    "branch": "codex/ST-STALE-A",
    "head_sha": "0c7e6e0ea94ce25d8c1fe0d78e4274954adefd90",
    "is_dirty": true,
    "user": {
      "name": "Finalization E2E",
      "email": "finalization-e2e@example.invalid"
    },
    "remotes": [
      "origin"
    ]
  },
  "run": {
    "run_id": null,
    "thread_id": null,
    "session_id": null,
    "tool": "agentic-sdlc-cli",
    "version": "0.94.0"
  },
  "created_at": "2026-10-10T04:34:18.256Z",
  "audit": {
    "created_by": {
      "id": "codex",
      "type": "agent",
      "name": "Codex",
      "email": null,
      "source": "default"
    },
    "git": {
      "is_git_repo": true,
      "branch": "codex/ST-STALE-A",
      "head_sha": "0c7e6e0ea94ce25d8c1fe0d78e4274954adefd90",
      "is_dirty": true,
      "user": {
        "name": "Finalization E2E",
        "email": "finalization-e2e@example.invalid"
      },
      "remotes": [
        "origin"
      ]
    },
    "run": {
      "run_id": null,
      "thread_id": null,
      "session_id": null,
      "tool": "agentic-sdlc-cli",
      "version": "0.94.0"
    }
  },
  "hash_algorithm": "sha256:stable-json:v1",
  "record_hash": "fdb397e896f8a2c96aeb21363655a5cce4308019c6233aeed3434f8437a613a5"
}
