{
  "kind": "secret_scan",
  "schema_version": "secret-scan:v1",
  "id": "ST-REC-A-secret-scan-20261010043513427-ba50b4",
  "story_id": "ST-REC-A",
  "delivery_id": null,
  "phase": "implementation",
  "summary": "Scanned 51 changed file(s) of ST-REC-A for credentials",
  "base_sha": "ebc3276106881e24f31451fb8d3eae93766a7688",
  "head_sha": "8e2122346e084921974dc304e770c57dc859cbd6",
  "workspace_state_hash": "4f53cda18c2baa0c0354bb5f9a3ecbe5ed12ab4d8e11ba873c2f11161202b945",
  "source": "git_range",
  "file_count": 51,
  "scanned_paths": [
    ".sdlc/authorization-uses/AUTH-REC-A-STORY-ACTIONS/AUSE-AUTH-REC-A-STORY-ACTIONS-20261010043449259-785aac.json",
    ".sdlc/authorization-uses/AUTH-REC-A-STORY-ACTIONS/AUSE-AUTH-REC-A-STORY-ACTIONS-20261010043450209-0980ca.json",
    ".sdlc/authorization-uses/AUTH-REC-A-STORY-ACTIONS/AUSE-AUTH-REC-A-STORY-ACTIONS-20261010043451089-75d4c7.json",
    ".sdlc/authorization-uses/AUTH-REC-A-STORY-ACTIONS/AUSE-AUTH-REC-A-STORY-ACTIONS-20261010043456904-02cd59.json",
    ".sdlc/authorizations/AUTH-REC-A-STORY-ACTIONS.json",
    ".sdlc/autonomy/actions/AUT-ACT-20261010043504208-b352b0.json",
    ".sdlc/autonomy/actions/AUT-ACT-20261010043506612-fbf9f5.json",
    ".sdlc/autonomy/approvals/AUT-APR-20261010043435862-c37a62.json",
    ".sdlc/autonomy/approvals/AUT-APR-20261010043443559-fcb5d4.json",
    ".sdlc/autonomy/decisions/AUT-DEC-20261010043443568-d7f3e0.json",
    ".sdlc/autonomy/decisions/AUT-DEC-20261010043445980-2ecae0.json",
    ".sdlc/autonomy/deliveries/AUT-REC-A.json",
    ".sdlc/autonomy/executions/AUT-REC-A/close.json",
    ".sdlc/autonomy/executions/AUT-REC-A/context-preflight.json",
    ".sdlc/autonomy/executions/AUT-REC-A/start.json",
    ".sdlc/autonomy/policy-sources/22a360ebbadbec680137e9ef033544f4420205e16c077e9717d92116c7ccbd0c.json",
    ".sdlc/autonomy/requirements/AUT-REQ-REC-A-R1.json",
    ".sdlc/contracts/CONTRACT-REC-A.json",
    ".sdlc/gates/ST-REC-A-strict.json",
    ".sdlc/output-contracts/registry.json",
    ".sdlc/output-contracts/templates/implementation-summary-v1.md",
    ".sdlc/receipts/verification/VERIFY-OUT-ST-REC-A-implementation-summary-01531197-ef466084.json",
    ".sdlc/requirements/REQ-REC-A.json",
    ".sdlc/security/ST-REC-A-secret-scan-20261010043500838-fe602d.json",
    ".sdlc/stories/ST-REC-A/claim.json",
    ".sdlc/stories/ST-REC-A/implementation-log.md",
    ".sdlc/stories/ST-REC-A/plan.md",
    ".sdlc/stories/ST-REC-A/steps/analysis.json",
    ".sdlc/stories/ST-REC-A/steps/design.json",
    ".sdlc/stories/ST-REC-A/steps/discovery.json",
    ".sdlc/stories/ST-REC-A/steps/history.jsonl",
    ".sdlc/stories/ST-REC-A/steps/implementation.json",
    ".sdlc/stories/ST-REC-A/steps/operations.json",
    ".sdlc/stories/ST-REC-A/steps/release.json",
    ".sdlc/stories/ST-REC-A/steps/validation.json",
    ".sdlc/stories/ST-REC-A/story.json",
    ".sdlc/stories/ST-REC-A/task-start.json",
    ".sdlc/tests/ST-REC-A-release.json",
    ".sdlc/tests/ST-REC-A-test.json",
    ".sdlc/traces/.integrity/project.jsonl.checkpoint.json",
    ".sdlc/traces/.integrity/ST-REC-A.jsonl.checkpoint.json",
    ".sdlc/traces/evidence/TR-20261010043458-8a1784/01-ST-REC-A-test.json",
    ".sdlc/traces/evidence/TR-20261010043509-5544d0/01-ST-REC-A-release.json",
    ".sdlc/traces/project.jsonl",
    ".sdlc/traces/ST-REC-A.jsonl",
    ".sdlc/workflows/instances/delivery-rec-a/checkpoint.json",
    ".sdlc/workflows/instances/delivery-rec-a/events.jsonl",
    ".sdlc/workflows/instances/delivery-rec-a/instance.json",
    "docs/implementation-summary-rec-a.md",
    "docs/pr-update-proof-rec-a.txt",
    "src/feature.mjs"
  ],
  "excluded_paths": [],
  "rule_set_hash": "0fb6df2e725c5f9b66cc7380d8e96ccccb4f7abb224dbdcf3c50768368fd81de",
  "rule_ids": [
    "aws_access_key_id",
    "aws_secret_access_key",
    "github_token",
    "slack_token",
    "private_key_block",
    "assigned_credential_literal"
  ],
  "findings": [],
  "outcome": "clean",
  "started_at": "2026-10-10T04:35:12.821Z",
  "finished_at": "2026-10-10T04:35:13.553Z",
  "duration_ms": 732,
  "requirement_ids": [],
  "actor": {
    "id": "codex",
    "type": "agent",
    "name": "Codex",
    "email": null,
    "source": "default"
  },
  "git": {
    "is_git_repo": true,
    "branch": "codex/ST-REC-A",
    "head_sha": "8e2122346e084921974dc304e770c57dc859cbd6",
    "is_dirty": true,
    "user": {
      "name": "Merged Certification E2E",
      "email": "merged-certification-e2e@example.invalid"
    },
    "remotes": [
      "origin"
    ]
  },
  "run": {
    "run_id": null,
    "thread_id": null,
    "session_id": null,
    "tool": "agentic-sdlc-cli",
    "version": "0.94.0"
  },
  "created_at": "2026-10-10T04:35:13.553Z",
  "audit": {
    "created_by": {
      "id": "codex",
      "type": "agent",
      "name": "Codex",
      "email": null,
      "source": "default"
    },
    "git": {
      "is_git_repo": true,
      "branch": "codex/ST-REC-A",
      "head_sha": "8e2122346e084921974dc304e770c57dc859cbd6",
      "is_dirty": true,
      "user": {
        "name": "Merged Certification E2E",
        "email": "merged-certification-e2e@example.invalid"
      },
      "remotes": [
        "origin"
      ]
    },
    "run": {
      "run_id": null,
      "thread_id": null,
      "session_id": null,
      "tool": "agentic-sdlc-cli",
      "version": "0.94.0"
    }
  },
  "hash_algorithm": "sha256:stable-json:v1",
  "record_hash": "fd0804eafda008ab9b6965369f5497e1767286c724f704cc95da384a33679268"
}
