{
  "kind": "secret_scan",
  "schema_version": "secret-scan:v1",
  "id": "ST-MERGE-A-secret-scan-20261010043722105-741d99",
  "story_id": "ST-MERGE-A",
  "delivery_id": null,
  "phase": "implementation",
  "summary": "Scanned 40 changed file(s) of ST-MERGE-A for credentials",
  "base_sha": "1e3410f108b3cd33f3a7d0d9dbf3935880728290",
  "head_sha": "1e3410f108b3cd33f3a7d0d9dbf3935880728290",
  "workspace_state_hash": "3c0ba7ececc089fd683602d20012bcd0367e13d7c970a34b71f1ee26b633d0ef",
  "source": "git_range",
  "file_count": 40,
  "scanned_paths": [
    ".sdlc/authorization-uses/AUTH-MERGE-A-STORY-ACTIONS/AUSE-AUTH-MERGE-A-STORY-ACTIONS-20261010043710378-c8b2df.json",
    ".sdlc/authorization-uses/AUTH-MERGE-A-STORY-ACTIONS/AUSE-AUTH-MERGE-A-STORY-ACTIONS-20261010043711297-b1898f.json",
    ".sdlc/authorization-uses/AUTH-MERGE-A-STORY-ACTIONS/AUSE-AUTH-MERGE-A-STORY-ACTIONS-20261010043712106-be0110.json",
    ".sdlc/authorization-uses/AUTH-MERGE-A-STORY-ACTIONS/AUSE-AUTH-MERGE-A-STORY-ACTIONS-20261010043718072-6de857.json",
    ".sdlc/authorizations/AUTH-MERGE-A-STORY-ACTIONS.json",
    ".sdlc/autonomy/approvals/AUT-APR-20261010043658500-b6377e.json",
    ".sdlc/autonomy/approvals/AUT-APR-20261010043706106-48aaa2.json",
    ".sdlc/autonomy/decisions/AUT-DEC-20261010043706113-7dfb41.json",
    ".sdlc/autonomy/decisions/AUT-DEC-20261010043708185-a0eddb.json",
    ".sdlc/autonomy/deliveries/AUT-MERGE-A.json",
    ".sdlc/autonomy/executions/AUT-MERGE-A/context-preflight.json",
    ".sdlc/autonomy/executions/AUT-MERGE-A/start.json",
    ".sdlc/autonomy/requirements/AUT-REQ-MERGE-A-R1.json",
    ".sdlc/contracts/CONTRACT-MERGE-A.json",
    ".sdlc/output-contracts/registry.json",
    ".sdlc/output-contracts/templates/implementation-summary-v1.md",
    ".sdlc/receipts/verification/VERIFY-OUT-ST-MERGE-A-implementation-summary-730158c5-30d0de35.json",
    ".sdlc/requirements/REQ-MERGE-A.json",
    ".sdlc/stories/ST-MERGE-A/claim.json",
    ".sdlc/stories/ST-MERGE-A/implementation-log.md",
    ".sdlc/stories/ST-MERGE-A/plan.md",
    ".sdlc/stories/ST-MERGE-A/steps/analysis.json",
    ".sdlc/stories/ST-MERGE-A/steps/design.json",
    ".sdlc/stories/ST-MERGE-A/steps/discovery.json",
    ".sdlc/stories/ST-MERGE-A/steps/history.jsonl",
    ".sdlc/stories/ST-MERGE-A/steps/implementation.json",
    ".sdlc/stories/ST-MERGE-A/steps/validation.json",
    ".sdlc/stories/ST-MERGE-A/story.json",
    ".sdlc/stories/ST-MERGE-A/task-start.json",
    ".sdlc/tests/ST-MERGE-A-test.json",
    ".sdlc/traces/.integrity/project.jsonl.checkpoint.json",
    ".sdlc/traces/.integrity/ST-MERGE-A.jsonl.checkpoint.json",
    ".sdlc/traces/evidence/TR-20261010043720-53d791/01-ST-MERGE-A-test.json",
    ".sdlc/traces/project.jsonl",
    ".sdlc/traces/ST-MERGE-A.jsonl",
    ".sdlc/workflows/instances/delivery-merge-a/checkpoint.json",
    ".sdlc/workflows/instances/delivery-merge-a/events.jsonl",
    ".sdlc/workflows/instances/delivery-merge-a/instance.json",
    "docs/implementation-summary-merge-a.md",
    "src/feature.mjs"
  ],
  "excluded_paths": [],
  "rule_set_hash": "0fb6df2e725c5f9b66cc7380d8e96ccccb4f7abb224dbdcf3c50768368fd81de",
  "rule_ids": [
    "aws_access_key_id",
    "aws_secret_access_key",
    "github_token",
    "slack_token",
    "private_key_block",
    "assigned_credential_literal"
  ],
  "findings": [],
  "outcome": "clean",
  "started_at": "2026-10-10T04:37:21.881Z",
  "finished_at": "2026-10-10T04:37:22.289Z",
  "duration_ms": 408,
  "requirement_ids": [],
  "actor": {
    "id": "codex",
    "type": "agent",
    "name": "Codex",
    "email": null,
    "source": "default"
  },
  "git": {
    "is_git_repo": true,
    "branch": "codex/ST-MERGE-A",
    "head_sha": "1e3410f108b3cd33f3a7d0d9dbf3935880728290",
    "is_dirty": true,
    "user": {
      "name": "Merged Certification E2E",
      "email": "merged-certification-e2e@example.invalid"
    },
    "remotes": [
      "origin"
    ]
  },
  "run": {
    "run_id": null,
    "thread_id": null,
    "session_id": null,
    "tool": "agentic-sdlc-cli",
    "version": "0.94.0"
  },
  "created_at": "2026-10-10T04:37:22.289Z",
  "audit": {
    "created_by": {
      "id": "codex",
      "type": "agent",
      "name": "Codex",
      "email": null,
      "source": "default"
    },
    "git": {
      "is_git_repo": true,
      "branch": "codex/ST-MERGE-A",
      "head_sha": "1e3410f108b3cd33f3a7d0d9dbf3935880728290",
      "is_dirty": true,
      "user": {
        "name": "Merged Certification E2E",
        "email": "merged-certification-e2e@example.invalid"
      },
      "remotes": [
        "origin"
      ]
    },
    "run": {
      "run_id": null,
      "thread_id": null,
      "session_id": null,
      "tool": "agentic-sdlc-cli",
      "version": "0.94.0"
    }
  },
  "hash_algorithm": "sha256:stable-json:v1",
  "record_hash": "f78491196e84687d3012043260c7810901161fe2556623d3b76392b38783c937"
}
