{
  "kind": "secret_scan",
  "schema_version": "secret-scan:v1",
  "id": "ST-FINAL-secret-scan-20261010043015145-0b4a33",
  "story_id": "ST-FINAL",
  "delivery_id": null,
  "phase": "implementation",
  "summary": "Scanned 46 changed file(s) of ST-FINAL for credentials",
  "base_sha": "c34eca2c1458a65aec285fd1dc699d0d47783794",
  "head_sha": "c34eca2c1458a65aec285fd1dc699d0d47783794",
  "workspace_state_hash": "f4d85a1b31a940aada6a34824d061ce2bcd7998f5e07f51f8ef2676cb088c470",
  "source": "git_range",
  "file_count": 46,
  "scanned_paths": [
    ".sdlc/authorization-uses/AUTH-FINAL-STORY-ACTIONS/AUSE-AUTH-FINAL-STORY-ACTIONS-20261010042958642-e433e9.json",
    ".sdlc/authorization-uses/AUTH-FINAL-STORY-ACTIONS/AUSE-AUTH-FINAL-STORY-ACTIONS-20261010043000818-f56a03.json",
    ".sdlc/authorization-uses/AUTH-FINAL-STORY-ACTIONS/AUSE-AUTH-FINAL-STORY-ACTIONS-20261010043001591-0565ae.json",
    ".sdlc/authorization-uses/AUTH-FINAL-STORY-ACTIONS/AUSE-AUTH-FINAL-STORY-ACTIONS-20261010043009991-d729f7.json",
    ".sdlc/authorizations/AUTH-FINAL-STORY-ACTIONS.json",
    ".sdlc/autonomy/approvals/AUT-APR-20261010042941636-84861e.json",
    ".sdlc/autonomy/approvals/AUT-APR-20261010042950855-55a63b.json",
    ".sdlc/autonomy/decisions/AUT-DEC-20261010042950871-1d159f.json",
    ".sdlc/autonomy/decisions/AUT-DEC-20261010042956238-a6c525.json",
    ".sdlc/autonomy/deliveries/AUT-FINAL.json",
    ".sdlc/autonomy/executions/AUT-FINAL/context-preflight.json",
    ".sdlc/autonomy/executions/AUT-FINAL/start.json",
    ".sdlc/autonomy/requirements/AUT-REQ-FINAL-R1.json",
    ".sdlc/contracts/CONTRACT-FINAL.json",
    ".sdlc/output-contracts/registry.json",
    ".sdlc/output-contracts/templates/implementation-summary-v1.md",
    ".sdlc/output-contracts/templates/release-notes-v1.md",
    ".sdlc/receipts/verification/VERIFY-OUT-ST-FINAL-implementation-summary-e04b7753-69bea543.json",
    ".sdlc/requirements/REQ-FINAL.json",
    ".sdlc/stories/ST-FINAL/claim.json",
    ".sdlc/stories/ST-FINAL/implementation-log.md",
    ".sdlc/stories/ST-FINAL/plan.md",
    ".sdlc/stories/ST-FINAL/steps/analysis.json",
    ".sdlc/stories/ST-FINAL/steps/design.json",
    ".sdlc/stories/ST-FINAL/steps/discovery.json",
    ".sdlc/stories/ST-FINAL/steps/history.jsonl",
    ".sdlc/stories/ST-FINAL/steps/implementation.json",
    ".sdlc/stories/ST-FINAL/steps/package-boundary-check.json",
    ".sdlc/stories/ST-FINAL/steps/validation.json",
    ".sdlc/stories/ST-FINAL/story.json",
    ".sdlc/stories/ST-FINAL/task-start.json",
    ".sdlc/tests/ST-FINAL-test.json",
    ".sdlc/traces/.integrity/project.jsonl.checkpoint.json",
    ".sdlc/traces/.integrity/ST-FINAL.jsonl.checkpoint.json",
    ".sdlc/traces/evidence/TR-20261010043013-892f01/01-ST-FINAL-test.json",
    ".sdlc/traces/project.jsonl",
    ".sdlc/traces/ST-FINAL.jsonl",
    ".sdlc/workflows/definitions/software-project-custom-final/v1.json",
    ".sdlc/workflows/instances/delivery-archive-final/checkpoint.json",
    ".sdlc/workflows/instances/delivery-archive-final/events.jsonl",
    ".sdlc/workflows/instances/delivery-archive-final/instance.json",
    ".sdlc/workflows/instances/delivery-final/checkpoint.json",
    ".sdlc/workflows/instances/delivery-final/events.jsonl",
    ".sdlc/workflows/instances/delivery-final/instance.json",
    "docs/implementation-summary.md",
    "docs/tracked-runtime.md"
  ],
  "excluded_paths": [
    "docs/deleted-runtime.md"
  ],
  "rule_set_hash": "0fb6df2e725c5f9b66cc7380d8e96ccccb4f7abb224dbdcf3c50768368fd81de",
  "rule_ids": [
    "aws_access_key_id",
    "aws_secret_access_key",
    "github_token",
    "slack_token",
    "private_key_block",
    "assigned_credential_literal"
  ],
  "findings": [],
  "outcome": "clean",
  "started_at": "2026-10-10T04:30:14.874Z",
  "finished_at": "2026-10-10T04:30:15.321Z",
  "duration_ms": 447,
  "requirement_ids": [],
  "actor": {
    "id": "codex",
    "type": "agent",
    "name": "Codex",
    "email": null,
    "source": "default"
  },
  "git": {
    "is_git_repo": true,
    "branch": "codex/ST-FINAL",
    "head_sha": "c34eca2c1458a65aec285fd1dc699d0d47783794",
    "is_dirty": true,
    "user": {
      "name": "Finalization E2E",
      "email": "finalization-e2e@example.invalid"
    },
    "remotes": [
      "origin"
    ]
  },
  "run": {
    "run_id": null,
    "thread_id": null,
    "session_id": null,
    "tool": "agentic-sdlc-cli",
    "version": "0.94.0"
  },
  "created_at": "2026-10-10T04:30:15.321Z",
  "audit": {
    "created_by": {
      "id": "codex",
      "type": "agent",
      "name": "Codex",
      "email": null,
      "source": "default"
    },
    "git": {
      "is_git_repo": true,
      "branch": "codex/ST-FINAL",
      "head_sha": "c34eca2c1458a65aec285fd1dc699d0d47783794",
      "is_dirty": true,
      "user": {
        "name": "Finalization E2E",
        "email": "finalization-e2e@example.invalid"
      },
      "remotes": [
        "origin"
      ]
    },
    "run": {
      "run_id": null,
      "thread_id": null,
      "session_id": null,
      "tool": "agentic-sdlc-cli",
      "version": "0.94.0"
    }
  },
  "hash_algorithm": "sha256:stable-json:v1",
  "record_hash": "2c22b45455e25d2bf4ed90f24b15c0cb83923aecfe815320c1b48be9ed7eae61"
}
