{
  "kind": "secret_scan",
  "schema_version": "secret-scan:v1",
  "id": "ST-FINAL-secret-scan-20261010043848622-6e90f6",
  "story_id": "ST-FINAL",
  "delivery_id": null,
  "phase": "implementation",
  "summary": "Scanned 71 changed file(s) of ST-FINAL for credentials",
  "base_sha": "e59fcb56c3325c8a73909d39285caed263617110",
  "head_sha": "e59fcb56c3325c8a73909d39285caed263617110",
  "workspace_state_hash": "5ff2a0c694f6e3aed86b4898682b2b9f3cff407dd263cb2f823cc20f01ead2b8",
  "source": "git_range",
  "file_count": 71,
  "scanned_paths": [
    ".sdlc/authorization-uses/AUTH-FINAL-STORY-ACTIONS/AUSE-AUTH-FINAL-STORY-ACTIONS-20261010043718830-3ce844.json",
    ".sdlc/authorization-uses/AUTH-FINAL-STORY-ACTIONS/AUSE-AUTH-FINAL-STORY-ACTIONS-20261010043720644-a9e719.json",
    ".sdlc/authorization-uses/AUTH-FINAL-STORY-ACTIONS/AUSE-AUTH-FINAL-STORY-ACTIONS-20261010043721492-09a1c3.json",
    ".sdlc/authorization-uses/AUTH-FINAL-STORY-ACTIONS/AUSE-AUTH-FINAL-STORY-ACTIONS-20261010043730192-0cbaab.json",
    ".sdlc/authorization-uses/AUTH-FINAL-STORY-ACTIONS/AUSE-AUTH-FINAL-STORY-ACTIONS-20261010043836076-a9930b.json",
    ".sdlc/authorization-uses/AUTH-FINAL-STORY-ACTIONS/AUSE-AUTH-FINAL-STORY-ACTIONS-20261010043836916-9a46e9.json",
    ".sdlc/authorizations/AUTH-FINAL-STORY-ACTIONS.json",
    ".sdlc/autonomy/actions/AUT-ACT-20261010043837814-a2ac43.json",
    ".sdlc/autonomy/actions/AUT-ACT-20261010043838813-7c805b.json",
    ".sdlc/autonomy/actions/AUT-ACT-20261010043839723-480e8e.json",
    ".sdlc/autonomy/actions/AUT-ACT-20261010043840697-5635b2.json",
    ".sdlc/autonomy/actions/AUT-ACT-20261010043841643-16381c.json",
    ".sdlc/autonomy/actions/AUT-ACT-20261010043842593-dc1327.json",
    ".sdlc/autonomy/approvals/AUT-APR-20261010043703239-850f5e.json",
    ".sdlc/autonomy/approvals/AUT-APR-20261010043711734-6ed5b8.json",
    ".sdlc/autonomy/decisions/AUT-DEC-20261010043711740-89ef24.json",
    ".sdlc/autonomy/decisions/AUT-DEC-20261010043716831-9d4d60.json",
    ".sdlc/autonomy/deliveries/AUT-FINAL.json",
    ".sdlc/autonomy/executions/AUT-FINAL/attempts/AUT-TRY-2d78855cd4be5076a7956415f6335158.json",
    ".sdlc/autonomy/executions/AUT-FINAL/close.json",
    ".sdlc/autonomy/executions/AUT-FINAL/context-preflight.json",
    ".sdlc/autonomy/executions/AUT-FINAL/start.json",
    ".sdlc/autonomy/policy-sources/433c4e9a26007ff8b336fcb75d0e452ab9aa3a702b9a0117588c30acdd9f3548.json",
    ".sdlc/autonomy/requirements/AUT-REQ-FINAL-R1.json",
    ".sdlc/contracts/CONTRACT-FINAL.json",
    ".sdlc/gates/ST-FINAL-strict.json",
    ".sdlc/output-contracts/registry.json",
    ".sdlc/output-contracts/templates/implementation-summary-v1.md",
    ".sdlc/output-contracts/templates/release-notes-v1.md",
    ".sdlc/receipts/verification/VERIFY-OUT-ST-FINAL-implementation-summary-e04b7753-69bea543.json",
    ".sdlc/receipts/verification/VERIFY-OUT-ST-FINAL-implementation-summary-e04b7753-dfd62b44.json",
    ".sdlc/receipts/verification/VERIFY-OUT-ST-FINAL-release-notes-5f5844fc-9b5931d6.json",
    ".sdlc/requirements/REQ-FINAL.json",
    ".sdlc/security/ST-FINAL-secret-scan-20261010043735008-429279.json",
    ".sdlc/security/ST-FINAL-secret-scan-20261010043817702-392c4a.json",
    ".sdlc/stories/ST-FINAL/claim.json",
    ".sdlc/stories/ST-FINAL/implementation-log.md",
    ".sdlc/stories/ST-FINAL/plan.md",
    ".sdlc/stories/ST-FINAL/steps/analysis.json",
    ".sdlc/stories/ST-FINAL/steps/design.json",
    ".sdlc/stories/ST-FINAL/steps/discovery.json",
    ".sdlc/stories/ST-FINAL/steps/history.jsonl",
    ".sdlc/stories/ST-FINAL/steps/implementation.json",
    ".sdlc/stories/ST-FINAL/steps/operations.json",
    ".sdlc/stories/ST-FINAL/steps/package-boundary-check.json",
    ".sdlc/stories/ST-FINAL/steps/release.json",
    ".sdlc/stories/ST-FINAL/steps/validation.json",
    ".sdlc/stories/ST-FINAL/story.json",
    ".sdlc/stories/ST-FINAL/task-start.json",
    ".sdlc/tests/ST-FINAL-release.json",
    ".sdlc/tests/ST-FINAL-test.json",
    ".sdlc/traces/.integrity/project.jsonl.checkpoint.json",
    ".sdlc/traces/.integrity/ST-FINAL.jsonl.checkpoint.json",
    ".sdlc/traces/evidence/TR-20261010043733-15ba72/01-ST-FINAL-test.json",
    ".sdlc/traces/evidence/TR-20261010043736-5c2c2f/01-ST-FINAL-test.json",
    ".sdlc/traces/evidence/TR-20261010043835-c24fab/01-ST-FINAL-release.json",
    ".sdlc/traces/project.jsonl",
    ".sdlc/traces/ST-FINAL.jsonl",
    ".sdlc/workflows/definitions/software-project-custom-final/v1.json",
    ".sdlc/workflows/instances/delivery-archive-final/checkpoint.json",
    ".sdlc/workflows/instances/delivery-archive-final/events.jsonl",
    ".sdlc/workflows/instances/delivery-archive-final/instance.json",
    ".sdlc/workflows/instances/delivery-final/checkpoint.json",
    ".sdlc/workflows/instances/delivery-final/events.jsonl",
    ".sdlc/workflows/instances/delivery-final/instance.json",
    "docs/implementation-summary.md",
    "docs/local-build-proof.json",
    "docs/local-release/app/release-proof.txt",
    "docs/local-release/rollback-rehearsal.json",
    "docs/release-notes.md",
    "docs/tracked-runtime.md"
  ],
  "excluded_paths": [
    "docs/deleted-runtime.md"
  ],
  "rule_set_hash": "0fb6df2e725c5f9b66cc7380d8e96ccccb4f7abb224dbdcf3c50768368fd81de",
  "rule_ids": [
    "aws_access_key_id",
    "aws_secret_access_key",
    "github_token",
    "slack_token",
    "private_key_block",
    "assigned_credential_literal"
  ],
  "findings": [],
  "outcome": "clean",
  "started_at": "2026-10-10T04:38:48.339Z",
  "finished_at": "2026-10-10T04:38:48.811Z",
  "duration_ms": 472,
  "requirement_ids": [],
  "actor": {
    "id": "codex",
    "type": "agent",
    "name": "Codex",
    "email": null,
    "source": "default"
  },
  "git": {
    "is_git_repo": true,
    "branch": "codex/ST-FINAL",
    "head_sha": "e59fcb56c3325c8a73909d39285caed263617110",
    "is_dirty": true,
    "user": {
      "name": "Finalization E2E",
      "email": "finalization-e2e@example.invalid"
    },
    "remotes": [
      "origin"
    ]
  },
  "run": {
    "run_id": null,
    "thread_id": null,
    "session_id": null,
    "tool": "agentic-sdlc-cli",
    "version": "0.94.0"
  },
  "created_at": "2026-10-10T04:38:48.811Z",
  "audit": {
    "created_by": {
      "id": "codex",
      "type": "agent",
      "name": "Codex",
      "email": null,
      "source": "default"
    },
    "git": {
      "is_git_repo": true,
      "branch": "codex/ST-FINAL",
      "head_sha": "e59fcb56c3325c8a73909d39285caed263617110",
      "is_dirty": true,
      "user": {
        "name": "Finalization E2E",
        "email": "finalization-e2e@example.invalid"
      },
      "remotes": [
        "origin"
      ]
    },
    "run": {
      "run_id": null,
      "thread_id": null,
      "session_id": null,
      "tool": "agentic-sdlc-cli",
      "version": "0.94.0"
    }
  },
  "hash_algorithm": "sha256:stable-json:v1",
  "record_hash": "9c1f425f7c1d615ab8da7aae69269c71362f46089ecb3bb195da8509675cc512"
}
