{
  "kind": "secret_scan",
  "schema_version": "secret-scan:v1",
  "id": "ST-SUCCESSOR-secret-scan-20261010043955780-fdbf05",
  "story_id": "ST-SUCCESSOR",
  "delivery_id": null,
  "phase": "implementation",
  "summary": "Scanned 39 changed file(s) of ST-SUCCESSOR for credentials",
  "base_sha": "e8263f73edc89e8c9c6a5ec230966b8a1c39860d",
  "head_sha": "e8263f73edc89e8c9c6a5ec230966b8a1c39860d",
  "workspace_state_hash": "a41bf2152d142933813fc799cf9a8298b4ba4cc8918c9a42e59cbec49412d921",
  "source": "git_range",
  "file_count": 39,
  "scanned_paths": [
    ".sdlc/authorization-uses/AUTH-SUCCESSOR-STORY-ACTIONS/AUSE-AUTH-SUCCESSOR-STORY-ACTIONS-20261010043943575-c7cdb6.json",
    ".sdlc/authorization-uses/AUTH-SUCCESSOR-STORY-ACTIONS/AUSE-AUTH-SUCCESSOR-STORY-ACTIONS-20261010043944452-8b6895.json",
    ".sdlc/authorization-uses/AUTH-SUCCESSOR-STORY-ACTIONS/AUSE-AUTH-SUCCESSOR-STORY-ACTIONS-20261010043945224-f9b9a0.json",
    ".sdlc/authorization-uses/AUTH-SUCCESSOR-STORY-ACTIONS/AUSE-AUTH-SUCCESSOR-STORY-ACTIONS-20261010043951107-6404b0.json",
    ".sdlc/authorizations/AUTH-SUCCESSOR-STORY-ACTIONS.json",
    ".sdlc/autonomy/approvals/AUT-APR-20261010043933294-1df853.json",
    ".sdlc/autonomy/approvals/AUT-APR-20261010043939786-6bf9e0.json",
    ".sdlc/autonomy/decisions/AUT-DEC-20261010043939793-cd9f41.json",
    ".sdlc/autonomy/decisions/AUT-DEC-20261010043941588-7a619d.json",
    ".sdlc/autonomy/deliveries/AUT-SUCCESSOR.json",
    ".sdlc/autonomy/executions/AUT-SUCCESSOR/context-preflight.json",
    ".sdlc/autonomy/executions/AUT-SUCCESSOR/start.json",
    ".sdlc/autonomy/requirements/AUT-REQ-SUCCESSOR-R1.json",
    ".sdlc/contracts/CONTRACT-SUCCESSOR.json",
    ".sdlc/output-contracts/registry.json",
    ".sdlc/output-contracts/templates/implementation-summary-v1.md",
    ".sdlc/receipts/verification/VERIFY-OUT-ST-SUCCESSOR-implementation-summary-e04b7753-a791c227.json",
    ".sdlc/requirements/REQ-SUCCESSOR.json",
    ".sdlc/stories/ST-SUCCESSOR/claim.json",
    ".sdlc/stories/ST-SUCCESSOR/implementation-log.md",
    ".sdlc/stories/ST-SUCCESSOR/plan.md",
    ".sdlc/stories/ST-SUCCESSOR/steps/analysis.json",
    ".sdlc/stories/ST-SUCCESSOR/steps/design.json",
    ".sdlc/stories/ST-SUCCESSOR/steps/discovery.json",
    ".sdlc/stories/ST-SUCCESSOR/steps/history.jsonl",
    ".sdlc/stories/ST-SUCCESSOR/steps/implementation.json",
    ".sdlc/stories/ST-SUCCESSOR/steps/validation.json",
    ".sdlc/stories/ST-SUCCESSOR/story.json",
    ".sdlc/stories/ST-SUCCESSOR/task-start.json",
    ".sdlc/tests/ST-SUCCESSOR-test.json",
    ".sdlc/traces/.integrity/project.jsonl.checkpoint.json",
    ".sdlc/traces/.integrity/ST-SUCCESSOR.jsonl.checkpoint.json",
    ".sdlc/traces/evidence/TR-20261010043953-782878/01-ST-SUCCESSOR-test.json",
    ".sdlc/traces/project.jsonl",
    ".sdlc/traces/ST-SUCCESSOR.jsonl",
    ".sdlc/workflows/instances/delivery-successor/checkpoint.json",
    ".sdlc/workflows/instances/delivery-successor/events.jsonl",
    ".sdlc/workflows/instances/delivery-successor/instance.json",
    "docs/implementation-summary.md"
  ],
  "excluded_paths": [],
  "rule_set_hash": "0fb6df2e725c5f9b66cc7380d8e96ccccb4f7abb224dbdcf3c50768368fd81de",
  "rule_ids": [
    "aws_access_key_id",
    "aws_secret_access_key",
    "github_token",
    "slack_token",
    "private_key_block",
    "assigned_credential_literal"
  ],
  "findings": [],
  "outcome": "clean",
  "started_at": "2026-10-10T04:39:55.269Z",
  "finished_at": "2026-10-10T04:39:56.015Z",
  "duration_ms": 746,
  "requirement_ids": [],
  "actor": {
    "id": "codex",
    "type": "agent",
    "name": "Codex",
    "email": null,
    "source": "default"
  },
  "git": {
    "is_git_repo": true,
    "branch": "codex/ST-SUCCESSOR",
    "head_sha": "e8263f73edc89e8c9c6a5ec230966b8a1c39860d",
    "is_dirty": true,
    "user": {
      "name": "Finalization E2E",
      "email": "finalization-e2e@example.invalid"
    },
    "remotes": [
      "origin"
    ]
  },
  "run": {
    "run_id": null,
    "thread_id": null,
    "session_id": null,
    "tool": "agentic-sdlc-cli",
    "version": "0.94.0"
  },
  "created_at": "2026-10-10T04:39:56.015Z",
  "audit": {
    "created_by": {
      "id": "codex",
      "type": "agent",
      "name": "Codex",
      "email": null,
      "source": "default"
    },
    "git": {
      "is_git_repo": true,
      "branch": "codex/ST-SUCCESSOR",
      "head_sha": "e8263f73edc89e8c9c6a5ec230966b8a1c39860d",
      "is_dirty": true,
      "user": {
        "name": "Finalization E2E",
        "email": "finalization-e2e@example.invalid"
      },
      "remotes": [
        "origin"
      ]
    },
    "run": {
      "run_id": null,
      "thread_id": null,
      "session_id": null,
      "tool": "agentic-sdlc-cli",
      "version": "0.94.0"
    }
  },
  "hash_algorithm": "sha256:stable-json:v1",
  "record_hash": "85beaafa9843d0e3fed192a6a3525cf86190276fe9a76f9f003ae3ca18830842"
}
