{
  "kind": "secret_scan",
  "schema_version": "secret-scan:v1",
  "id": "ST-MERGE-A-secret-scan-20261010043016903-7ab6b4",
  "story_id": "ST-MERGE-A",
  "delivery_id": null,
  "phase": "implementation",
  "summary": "Scanned 51 changed file(s) of ST-MERGE-A for credentials",
  "base_sha": "ffbe170d17bc74f81bc44212152ac13909aec989",
  "head_sha": "dc1e0fcf04530e7b67a4659c53fc760dcfafa5ba",
  "workspace_state_hash": "4f53cda18c2baa0c0354bb5f9a3ecbe5ed12ab4d8e11ba873c2f11161202b945",
  "source": "git_range",
  "file_count": 51,
  "scanned_paths": [
    ".sdlc/authorization-uses/AUTH-MERGE-A-STORY-ACTIONS/AUSE-AUTH-MERGE-A-STORY-ACTIONS-20261010042950801-d1170b.json",
    ".sdlc/authorization-uses/AUTH-MERGE-A-STORY-ACTIONS/AUSE-AUTH-MERGE-A-STORY-ACTIONS-20261010042951839-70f46d.json",
    ".sdlc/authorization-uses/AUTH-MERGE-A-STORY-ACTIONS/AUSE-AUTH-MERGE-A-STORY-ACTIONS-20261010042952697-7f428c.json",
    ".sdlc/authorization-uses/AUTH-MERGE-A-STORY-ACTIONS/AUSE-AUTH-MERGE-A-STORY-ACTIONS-20261010042958845-bd7537.json",
    ".sdlc/authorizations/AUTH-MERGE-A-STORY-ACTIONS.json",
    ".sdlc/autonomy/actions/AUT-ACT-20261010043007156-8e2a29.json",
    ".sdlc/autonomy/actions/AUT-ACT-20261010043009895-18e9a4.json",
    ".sdlc/autonomy/approvals/AUT-APR-20261010042937514-b15943.json",
    ".sdlc/autonomy/approvals/AUT-APR-20261010042944849-ec418b.json",
    ".sdlc/autonomy/decisions/AUT-DEC-20261010042944864-79bc26.json",
    ".sdlc/autonomy/decisions/AUT-DEC-20261010042947594-0fe8b5.json",
    ".sdlc/autonomy/deliveries/AUT-MERGE-A.json",
    ".sdlc/autonomy/executions/AUT-MERGE-A/close.json",
    ".sdlc/autonomy/executions/AUT-MERGE-A/context-preflight.json",
    ".sdlc/autonomy/executions/AUT-MERGE-A/start.json",
    ".sdlc/autonomy/policy-sources/f2733bd56106ba0f7dfc2d0aa2c94379b7363486e22bdfd87c88ce9056eb271e.json",
    ".sdlc/autonomy/requirements/AUT-REQ-MERGE-A-R1.json",
    ".sdlc/contracts/CONTRACT-MERGE-A.json",
    ".sdlc/gates/ST-MERGE-A-strict.json",
    ".sdlc/output-contracts/registry.json",
    ".sdlc/output-contracts/templates/implementation-summary-v1.md",
    ".sdlc/receipts/verification/VERIFY-OUT-ST-MERGE-A-implementation-summary-730158c5-30d0de35.json",
    ".sdlc/requirements/REQ-MERGE-A.json",
    ".sdlc/security/ST-MERGE-A-secret-scan-20261010043003240-ac1cc6.json",
    ".sdlc/stories/ST-MERGE-A/claim.json",
    ".sdlc/stories/ST-MERGE-A/implementation-log.md",
    ".sdlc/stories/ST-MERGE-A/plan.md",
    ".sdlc/stories/ST-MERGE-A/steps/analysis.json",
    ".sdlc/stories/ST-MERGE-A/steps/design.json",
    ".sdlc/stories/ST-MERGE-A/steps/discovery.json",
    ".sdlc/stories/ST-MERGE-A/steps/history.jsonl",
    ".sdlc/stories/ST-MERGE-A/steps/implementation.json",
    ".sdlc/stories/ST-MERGE-A/steps/operations.json",
    ".sdlc/stories/ST-MERGE-A/steps/release.json",
    ".sdlc/stories/ST-MERGE-A/steps/validation.json",
    ".sdlc/stories/ST-MERGE-A/story.json",
    ".sdlc/stories/ST-MERGE-A/task-start.json",
    ".sdlc/tests/ST-MERGE-A-release.json",
    ".sdlc/tests/ST-MERGE-A-test.json",
    ".sdlc/traces/.integrity/project.jsonl.checkpoint.json",
    ".sdlc/traces/.integrity/ST-MERGE-A.jsonl.checkpoint.json",
    ".sdlc/traces/evidence/TR-20261010043001-5bbe22/01-ST-MERGE-A-test.json",
    ".sdlc/traces/evidence/TR-20261010043012-0307e4/01-ST-MERGE-A-release.json",
    ".sdlc/traces/project.jsonl",
    ".sdlc/traces/ST-MERGE-A.jsonl",
    ".sdlc/workflows/instances/delivery-merge-a/checkpoint.json",
    ".sdlc/workflows/instances/delivery-merge-a/events.jsonl",
    ".sdlc/workflows/instances/delivery-merge-a/instance.json",
    "docs/implementation-summary-merge-a.md",
    "docs/pr-update-proof-merge-a.txt",
    "src/feature.mjs"
  ],
  "excluded_paths": [],
  "rule_set_hash": "0fb6df2e725c5f9b66cc7380d8e96ccccb4f7abb224dbdcf3c50768368fd81de",
  "rule_ids": [
    "aws_access_key_id",
    "aws_secret_access_key",
    "github_token",
    "slack_token",
    "private_key_block",
    "assigned_credential_literal"
  ],
  "findings": [],
  "outcome": "clean",
  "started_at": "2026-10-10T04:30:16.577Z",
  "finished_at": "2026-10-10T04:30:17.095Z",
  "duration_ms": 518,
  "requirement_ids": [],
  "actor": {
    "id": "codex",
    "type": "agent",
    "name": "Codex",
    "email": null,
    "source": "default"
  },
  "git": {
    "is_git_repo": true,
    "branch": "codex/ST-MERGE-A",
    "head_sha": "dc1e0fcf04530e7b67a4659c53fc760dcfafa5ba",
    "is_dirty": true,
    "user": {
      "name": "Merged Certification E2E",
      "email": "merged-certification-e2e@example.invalid"
    },
    "remotes": [
      "origin"
    ]
  },
  "run": {
    "run_id": null,
    "thread_id": null,
    "session_id": null,
    "tool": "agentic-sdlc-cli",
    "version": "0.94.0"
  },
  "created_at": "2026-10-10T04:30:17.095Z",
  "audit": {
    "created_by": {
      "id": "codex",
      "type": "agent",
      "name": "Codex",
      "email": null,
      "source": "default"
    },
    "git": {
      "is_git_repo": true,
      "branch": "codex/ST-MERGE-A",
      "head_sha": "dc1e0fcf04530e7b67a4659c53fc760dcfafa5ba",
      "is_dirty": true,
      "user": {
        "name": "Merged Certification E2E",
        "email": "merged-certification-e2e@example.invalid"
      },
      "remotes": [
        "origin"
      ]
    },
    "run": {
      "run_id": null,
      "thread_id": null,
      "session_id": null,
      "tool": "agentic-sdlc-cli",
      "version": "0.94.0"
    }
  },
  "hash_algorithm": "sha256:stable-json:v1",
  "record_hash": "af55e617c234aef37cae2e66f0cd67a39a9b9fab68ccf1b0b2bb66e635ffbddb"
}
