{
  "kind": "secret_scan",
  "schema_version": "secret-scan:v1",
  "id": "ST-STALE-A-secret-scan-20261010064329275-2f1376",
  "story_id": "ST-STALE-A",
  "delivery_id": null,
  "phase": "implementation",
  "summary": "Scanned 60 changed file(s) of ST-STALE-A for credentials",
  "base_sha": "dbb6e73a9e9dd89ff52ed9dad170624e03a6a405",
  "head_sha": "dbb6e73a9e9dd89ff52ed9dad170624e03a6a405",
  "workspace_state_hash": "53e233aac1ac05e2c00cec2669a3e3f399a4d3cde994cd2f0a2a48d4b331715b",
  "source": "git_range",
  "file_count": 60,
  "scanned_paths": [
    ".sdlc/authorization-uses/AUTH-STALE-A-STORY-ACTIONS/AUSE-AUTH-STALE-A-STORY-ACTIONS-20261010064303705-1f343d.json",
    ".sdlc/authorization-uses/AUTH-STALE-A-STORY-ACTIONS/AUSE-AUTH-STALE-A-STORY-ACTIONS-20261010064304621-f475c9.json",
    ".sdlc/authorization-uses/AUTH-STALE-A-STORY-ACTIONS/AUSE-AUTH-STALE-A-STORY-ACTIONS-20261010064305520-617523.json",
    ".sdlc/authorization-uses/AUTH-STALE-A-STORY-ACTIONS/AUSE-AUTH-STALE-A-STORY-ACTIONS-20261010064311416-8ae41f.json",
    ".sdlc/authorizations/AUTH-STALE-A-STORY-ACTIONS.json",
    ".sdlc/autonomy/actions/AUT-ACT-20261010064318447-8697ba.json",
    ".sdlc/autonomy/actions/AUT-ACT-20261010064319424-c23b57.json",
    ".sdlc/autonomy/actions/AUT-ACT-20261010064320409-8b9346.json",
    ".sdlc/autonomy/actions/AUT-ACT-20261010064321392-c0a48e.json",
    ".sdlc/autonomy/actions/AUT-ACT-20261010064322383-f45370.json",
    ".sdlc/autonomy/actions/AUT-ACT-20261010064323801-eae59d.json",
    ".sdlc/autonomy/approvals/AUT-APR-20261010064252285-446194.json",
    ".sdlc/autonomy/approvals/AUT-APR-20261010064259147-6d8c6c.json",
    ".sdlc/autonomy/decisions/AUT-DEC-20261010064259155-c27ebb.json",
    ".sdlc/autonomy/decisions/AUT-DEC-20261010064301118-e35f5c.json",
    ".sdlc/autonomy/deliveries/AUT-STALE-A.json",
    ".sdlc/autonomy/executions/AUT-STALE-A/attempts/AUT-TRY-a6e5b8f1124bfa5fbeb7c808d7502e11.json",
    ".sdlc/autonomy/executions/AUT-STALE-A/close.json",
    ".sdlc/autonomy/executions/AUT-STALE-A/context-preflight.json",
    ".sdlc/autonomy/executions/AUT-STALE-A/start.json",
    ".sdlc/autonomy/policy-sources/fa48db926fcd251fb252f753f44e97687bb97d4b9c97c31f4d90cbaf9e4777e6.json",
    ".sdlc/autonomy/requirements/AUT-REQ-STALE-A-R1.json",
    ".sdlc/contracts/CONTRACT-STALE-A.json",
    ".sdlc/gates/ST-STALE-A-strict.json",
    ".sdlc/output-contracts/registry.json",
    ".sdlc/output-contracts/templates/implementation-summary-v1.md",
    ".sdlc/receipts/verification/VERIFY-OUT-ST-STALE-A-implementation-summary-4578169c-971ef103.json",
    ".sdlc/requirements/REQ-STALE-A.json",
    ".sdlc/security/ST-STALE-A-secret-scan-20261010064315696-19c8bd.json",
    ".sdlc/stories/ST-STALE-A/claim.json",
    ".sdlc/stories/ST-STALE-A/implementation-log.md",
    ".sdlc/stories/ST-STALE-A/plan.md",
    ".sdlc/stories/ST-STALE-A/steps/analysis.json",
    ".sdlc/stories/ST-STALE-A/steps/design.json",
    ".sdlc/stories/ST-STALE-A/steps/discovery.json",
    ".sdlc/stories/ST-STALE-A/steps/history.jsonl",
    ".sdlc/stories/ST-STALE-A/steps/implementation.json",
    ".sdlc/stories/ST-STALE-A/steps/operations.json",
    ".sdlc/stories/ST-STALE-A/steps/release.json",
    ".sdlc/stories/ST-STALE-A/steps/validation.json",
    ".sdlc/stories/ST-STALE-A/story.json",
    ".sdlc/stories/ST-STALE-A/task-start.json",
    ".sdlc/tests/ST-STALE-A-release.json",
    ".sdlc/tests/ST-STALE-A-test.json",
    ".sdlc/traces/.integrity/project.jsonl.checkpoint.json",
    ".sdlc/traces/.integrity/ST-STALE-A.jsonl.checkpoint.json",
    ".sdlc/traces/evidence/TR-20261010064313-1d0f3f/01-ST-STALE-A-test.json",
    ".sdlc/traces/evidence/TR-20261010064325-cb928b/01-ST-STALE-A-release.json",
    ".sdlc/traces/project.jsonl",
    ".sdlc/traces/ST-STALE-A.jsonl",
    ".sdlc/workflows/instances/delivery-stale-a/checkpoint.json",
    ".sdlc/workflows/instances/delivery-stale-a/events.jsonl",
    ".sdlc/workflows/instances/delivery-stale-a/instance.json",
    "docs/implementation-summary-stale-a.md",
    "docs/local-build-stale-a.json",
    "docs/local-release/app/release-proof.txt",
    "docs/release-proof-stale-a.json",
    "docs/rollback-rehearsal-stale-a.json",
    "docs/shared.md",
    "src/feature.mjs"
  ],
  "excluded_paths": [],
  "rule_set_hash": "0fb6df2e725c5f9b66cc7380d8e96ccccb4f7abb224dbdcf3c50768368fd81de",
  "rule_ids": [
    "aws_access_key_id",
    "aws_secret_access_key",
    "github_token",
    "slack_token",
    "private_key_block",
    "assigned_credential_literal"
  ],
  "findings": [],
  "outcome": "clean",
  "started_at": "2026-10-10T06:43:29.052Z",
  "finished_at": "2026-10-10T06:43:29.400Z",
  "duration_ms": 348,
  "requirement_ids": [],
  "actor": {
    "id": "codex",
    "type": "agent",
    "name": "Codex",
    "email": null,
    "source": "default"
  },
  "git": {
    "is_git_repo": true,
    "branch": "codex/ST-STALE-A",
    "head_sha": "dbb6e73a9e9dd89ff52ed9dad170624e03a6a405",
    "is_dirty": true,
    "user": {
      "name": "Finalization E2E",
      "email": "finalization-e2e@example.invalid"
    },
    "remotes": [
      "origin"
    ]
  },
  "run": {
    "run_id": null,
    "thread_id": null,
    "session_id": null,
    "tool": "agentic-sdlc-cli",
    "version": "0.104.0"
  },
  "created_at": "2026-10-10T06:43:29.400Z",
  "audit": {
    "created_by": {
      "id": "codex",
      "type": "agent",
      "name": "Codex",
      "email": null,
      "source": "default"
    },
    "git": {
      "is_git_repo": true,
      "branch": "codex/ST-STALE-A",
      "head_sha": "dbb6e73a9e9dd89ff52ed9dad170624e03a6a405",
      "is_dirty": true,
      "user": {
        "name": "Finalization E2E",
        "email": "finalization-e2e@example.invalid"
      },
      "remotes": [
        "origin"
      ]
    },
    "run": {
      "run_id": null,
      "thread_id": null,
      "session_id": null,
      "tool": "agentic-sdlc-cli",
      "version": "0.104.0"
    }
  },
  "hash_algorithm": "sha256:stable-json:v1",
  "record_hash": "ef1a781b64a06a63f956eb2380cbd03b25a8c4da951acb10f6028da914644d73"
}
