{
  "kind": "secret_scan",
  "schema_version": "secret-scan:v1",
  "id": "ST-RECHK-A-secret-scan-20261010043534710-a696b8",
  "story_id": "ST-RECHK-A",
  "delivery_id": null,
  "phase": "implementation",
  "summary": "Scanned 60 changed file(s) of ST-RECHK-A for credentials",
  "base_sha": "de5b352ba474e4ca568ef4a6a9d7858f625c7937",
  "head_sha": "de5b352ba474e4ca568ef4a6a9d7858f625c7937",
  "workspace_state_hash": "48ab86881d22a26e54f8325bc8c18e17a3b26e3fc38ff0accaff3f6587197466",
  "source": "git_range",
  "file_count": 60,
  "scanned_paths": [
    ".sdlc/authorization-uses/AUTH-RECHK-A-STORY-ACTIONS/AUSE-AUTH-RECHK-A-STORY-ACTIONS-20261010043509147-0ec87a.json",
    ".sdlc/authorization-uses/AUTH-RECHK-A-STORY-ACTIONS/AUSE-AUTH-RECHK-A-STORY-ACTIONS-20261010043510162-d9f2c1.json",
    ".sdlc/authorization-uses/AUTH-RECHK-A-STORY-ACTIONS/AUSE-AUTH-RECHK-A-STORY-ACTIONS-20261010043510959-90df63.json",
    ".sdlc/authorization-uses/AUTH-RECHK-A-STORY-ACTIONS/AUSE-AUTH-RECHK-A-STORY-ACTIONS-20261010043516635-7d9926.json",
    ".sdlc/authorizations/AUTH-RECHK-A-STORY-ACTIONS.json",
    ".sdlc/autonomy/actions/AUT-ACT-20261010043523831-945890.json",
    ".sdlc/autonomy/actions/AUT-ACT-20261010043524940-9b00d4.json",
    ".sdlc/autonomy/actions/AUT-ACT-20261010043525845-bca63b.json",
    ".sdlc/autonomy/actions/AUT-ACT-20261010043526786-75c1c0.json",
    ".sdlc/autonomy/actions/AUT-ACT-20261010043527731-6891a9.json",
    ".sdlc/autonomy/actions/AUT-ACT-20261010043528687-2e4479.json",
    ".sdlc/autonomy/approvals/AUT-APR-20261010043458546-066d3e.json",
    ".sdlc/autonomy/approvals/AUT-APR-20261010043505227-5c2197.json",
    ".sdlc/autonomy/decisions/AUT-DEC-20261010043505236-97d189.json",
    ".sdlc/autonomy/decisions/AUT-DEC-20261010043507105-7c12bd.json",
    ".sdlc/autonomy/deliveries/AUT-RECHK-A.json",
    ".sdlc/autonomy/executions/AUT-RECHK-A/attempts/AUT-TRY-75723102b0d762661bafc152aaea57f8.json",
    ".sdlc/autonomy/executions/AUT-RECHK-A/close.json",
    ".sdlc/autonomy/executions/AUT-RECHK-A/context-preflight.json",
    ".sdlc/autonomy/executions/AUT-RECHK-A/start.json",
    ".sdlc/autonomy/policy-sources/5582347d22a9d60eac3731a3bf93e21a7067856043a5c7ad10067e01f8aa5723.json",
    ".sdlc/autonomy/requirements/AUT-REQ-RECHK-A-R1.json",
    ".sdlc/contracts/CONTRACT-RECHK-A.json",
    ".sdlc/gates/ST-RECHK-A-strict.json",
    ".sdlc/output-contracts/registry.json",
    ".sdlc/output-contracts/templates/implementation-summary-v1.md",
    ".sdlc/receipts/verification/VERIFY-OUT-ST-RECHK-A-implementation-summary-f534a1f9-1137d1e1.json",
    ".sdlc/requirements/REQ-RECHK-A.json",
    ".sdlc/security/ST-RECHK-A-secret-scan-20261010043520856-71e866.json",
    ".sdlc/stories/ST-RECHK-A/claim.json",
    ".sdlc/stories/ST-RECHK-A/implementation-log.md",
    ".sdlc/stories/ST-RECHK-A/plan.md",
    ".sdlc/stories/ST-RECHK-A/steps/analysis.json",
    ".sdlc/stories/ST-RECHK-A/steps/design.json",
    ".sdlc/stories/ST-RECHK-A/steps/discovery.json",
    ".sdlc/stories/ST-RECHK-A/steps/history.jsonl",
    ".sdlc/stories/ST-RECHK-A/steps/implementation.json",
    ".sdlc/stories/ST-RECHK-A/steps/operations.json",
    ".sdlc/stories/ST-RECHK-A/steps/release.json",
    ".sdlc/stories/ST-RECHK-A/steps/validation.json",
    ".sdlc/stories/ST-RECHK-A/story.json",
    ".sdlc/stories/ST-RECHK-A/task-start.json",
    ".sdlc/tests/ST-RECHK-A-release.json",
    ".sdlc/tests/ST-RECHK-A-test.json",
    ".sdlc/traces/.integrity/project.jsonl.checkpoint.json",
    ".sdlc/traces/.integrity/ST-RECHK-A.jsonl.checkpoint.json",
    ".sdlc/traces/evidence/TR-20261010043518-387df6/01-ST-RECHK-A-test.json",
    ".sdlc/traces/evidence/TR-20261010043530-b356b0/01-ST-RECHK-A-release.json",
    ".sdlc/traces/project.jsonl",
    ".sdlc/traces/ST-RECHK-A.jsonl",
    ".sdlc/workflows/instances/delivery-rechk-a/checkpoint.json",
    ".sdlc/workflows/instances/delivery-rechk-a/events.jsonl",
    ".sdlc/workflows/instances/delivery-rechk-a/instance.json",
    "docs/implementation-summary-rechk-a.md",
    "docs/local-build-rechk-a.json",
    "docs/local-release/app/release-proof.txt",
    "docs/release-proof-rechk-a.json",
    "docs/rollback-rehearsal-rechk-a.json",
    "docs/shared.md",
    "src/feature.mjs"
  ],
  "excluded_paths": [],
  "rule_set_hash": "0fb6df2e725c5f9b66cc7380d8e96ccccb4f7abb224dbdcf3c50768368fd81de",
  "rule_ids": [
    "aws_access_key_id",
    "aws_secret_access_key",
    "github_token",
    "slack_token",
    "private_key_block",
    "assigned_credential_literal"
  ],
  "findings": [],
  "outcome": "clean",
  "started_at": "2026-10-10T04:35:34.425Z",
  "finished_at": "2026-10-10T04:35:34.865Z",
  "duration_ms": 440,
  "requirement_ids": [],
  "actor": {
    "id": "codex",
    "type": "agent",
    "name": "Codex",
    "email": null,
    "source": "default"
  },
  "git": {
    "is_git_repo": true,
    "branch": "codex/ST-RECHK-A",
    "head_sha": "de5b352ba474e4ca568ef4a6a9d7858f625c7937",
    "is_dirty": true,
    "user": {
      "name": "Finalization E2E",
      "email": "finalization-e2e@example.invalid"
    },
    "remotes": [
      "origin"
    ]
  },
  "run": {
    "run_id": null,
    "thread_id": null,
    "session_id": null,
    "tool": "agentic-sdlc-cli",
    "version": "0.94.0"
  },
  "created_at": "2026-10-10T04:35:34.865Z",
  "audit": {
    "created_by": {
      "id": "codex",
      "type": "agent",
      "name": "Codex",
      "email": null,
      "source": "default"
    },
    "git": {
      "is_git_repo": true,
      "branch": "codex/ST-RECHK-A",
      "head_sha": "de5b352ba474e4ca568ef4a6a9d7858f625c7937",
      "is_dirty": true,
      "user": {
        "name": "Finalization E2E",
        "email": "finalization-e2e@example.invalid"
      },
      "remotes": [
        "origin"
      ]
    },
    "run": {
      "run_id": null,
      "thread_id": null,
      "session_id": null,
      "tool": "agentic-sdlc-cli",
      "version": "0.94.0"
    }
  },
  "hash_algorithm": "sha256:stable-json:v1",
  "record_hash": "28ee155ff7fe3e896b685be97ebc8d74b63d52424cd89fe272c4943353a119bf"
}
